{
  "$schema": "http://json-schema.org/draft-07/schema#",
  "$id": "https://framework.local/schemas/install-components.schema.json",
  "title": "Install Components",
  "type": "object",
  "required": ["version", "components"],
  "properties": {
    "version": {
      "type": "string"
    },
    "name": {
      "type": "string"
    },
    "description": {
      "type": "string"
    },
    "components": {
      "type": "object",
      "additionalProperties": {
        "type": "object",
        "required": ["name", "files"],
        "properties": {
          "name": { "type": "string" },
          "description": { "type": "string" },
          "required": { "type": "boolean" },
          "files": {
            "type": "array",
            "items": { "type": "string" }
          },
          "dependencies": {
            "type": "array",
            "items": { "type": "string" }
          }
        }
      }
    },
    "profiles": {
      "type": "object",
      "additionalProperties": {
        "type": "object",
        "required": ["name", "components"],
        "properties": {
          "name": { "type": "string" },
          "description": { "type": "string" },
          "components": {
            "type": "array",
            "items": { "type": "string" }
          }
        }
      }
    }
  }
}
